{
  "schema_version": 1,
  "id": "bounds-probe",
  "snapshot": {
    "snapshot_hz": 1,
    "max_entities_per_snapshot": 1,
    "egress_budget_kib_s_per_session": 100000.0
  },
  "input": {
    "client_send_hz": 1,
    "carry_forward_max_ticks": 0,
    "rate_limit_hz": 1000,
    "protocol_violation_hz": 10000
  },
  "prediction": {
    "remote_interp_delay_ms": 0.0,
    "remote_extrapolate_max_ms": 0.0,
    "reconcile_ignore_threshold_m": 0.0,
    "reconcile_smooth_threshold_m": 0.25,
    "reconcile_smooth_duration_ms": 200.0,
    "reconcile_hard_snap_threshold_m": 5.0,
    "reconcile_orientation_ignore_threshold_deg": 0.0,
    "reconcile_orientation_smooth_threshold_deg": 1.0,
    "reconcile_orientation_hard_snap_deg": 15.0
  }
}
